Original,Adversarial,FeatureCosSim,SBERT_Sim,BERTScoreF1,PSNR_dB,Linf_Norm
"The video showcases the vibrant and dynamic process of stir-frying, capturing the cook's skillful manipulation of ingredients in a hot pan. The cook begins by adding a variety of colorful vegetables, including red bell peppers, green onions, and leafy greens, to a sizzling wok. With quick and precise movements, the cook tosses and turns the ingredients, ensuring that each piece is evenly cooked and coated with a flavorful sauce. The cook's expertise is evident as they skillfully combine the flavors and textures, creating a dish that is both visually appealing and likely packed with nut and flavor. Throughout the video, the cook's focus and dexterity highlight the importance of technique in creating a delicious stir-fry.","The video showcases the vibrant and dynamic process of cooking a colorful stir-fry dish. The cook skillfully combines a variety of fresh vegetables, including bright red peppers, crisp green onions, and other ingredients, all sizzling and mixing in a hot pan. The quick and precise movements of the cook suggest a focus on maintaining the vegetables' texture and freshness while ensuring an even cooking process. The repeated tossing and turning of the vegetables indicate a thorough and even cooking technique, which is essential for a dish where the ingredients' individual flavors and colors need to be preserved. The cook's expertise is evident in the way the ingredients are handled, suggesting a commitment to creating a visually appealing and delicious meal.",0.9939,0.9358,0.6524,26.2,2
"In the video, a child is engaged in a playful activity, folding a piece of clothing. The child carefully arranges the fabric, smoothing out the wrinkles with tiny, deliberate motions. As the child folds the clothing, the fabric becomes more compact, neatly arranged with each precise crease. The child's focus and concentration are evident as they meticulously transform the fabric into a tidy, well-folded piece, demonstrating an early introduction to the art of tidiness and organization. The simplicity of the task, coupled with the child's earnest effort, conveys a sense of learning and growth through everyday activities.","In the video, a person is engaged in the process of folding clothes. They start with a blue garment spread out on a, and with careful movements, they up the fabric, folding it neatly. The person takes their time to ensure the folding is precise, perhaps indicative of a routine or a meticulous nature. As the folding progresses, the clothing transforms from a flat, open state into a more compact, tidy package. The final frames suggest the completion of the task, leaving the viewer with a sense of order and cleanliness.",0.9869,0.754,0.5464,24.68,2
"In the video, a person is seen riding a bike across a busy intersection. The camera follows the individual as they navigate through the traffic. Other people can be seen walking across the street, and cars are passing by. The scene captures the hustle and bustle of urban life, with the cyclist and pedestrians all sharing the space of the intersection. The person on the bike seems focused and confident as they maneuver through the traffic, indicating a sense of familiarity with the area. The video provides a dynamic perspective of city life, highlighting the movement and energy of the urban environment.","In the video, a person is seen riding a bike across a busy intersection. The rider is wearing a backpack and is signaling while crossing. The scene captures the hustle and bustle of the city with multiple cars and pedestrians in the background. The rider navigates through the traffic with caution and makes it safely to the other side. The video highlights the importance of road safety and following traffic rules while biking in urban areas.",0.9725,0.8563,0.6354,24.53,2
"In a concert hall, a young harpist dressed in a dark blue outfit with a glittering headband performs a piece of music. She skillfully plucks the strings of her large harp with both hands, creating a melodious tune. The harpist's focused and graceful movements suggest a deep connection to the music she is playing. The performance is meticulous and passionate, showcasing the of the harpist and the enchanting sound of the harp.","In a concert hall, a young harpist dressed in a dark blue outfit performs with grace and concentration. She skillfully plucks the strings of her large harp, creating a melodious and harmonious piece of music. The audience is captivated by her performance, as she seamlessly transitions between different of harp music, showcasing her talent and dedication to her craft. The atmosphere is filled with the resonant sounds of the harp, and the audience is visibly moved by the beauty of the music.",0.9816,0.9518,0.682,26.36,2
"The video captures a person counting a large stack of money. The individual is seen carefully going through the bills one by one, ensuring accuracy. The money appears to be in US currency, with denominations ranging from $20 to $100. The person is seated at a table, with a laptop and a few other items in the background. The counting process is done with focus and precision, suggesting that the money may be for a specific purpose or event. The video provides a clear view of each bill, allowing the viewer to confirm the count. Overall, the video conveys a sense of meticulousness and attention to detail in handling financial transactions.","The video captures a person counting a collection of money. The individual is seen carefully going through the bills, one by one, as they count and possibly organize the cash. The focus is on the money counting process, which is carried out with attention to detail.",0.9836,0.8763,0.607,27.1,2
"In a modern news studio, an anchor in a dark suit confidently presents the latest weather forecast. Behind him, the wall is filled with multiple screens displaying a detailed weather map and radar imagery. As he gestures towards the maps, he explains the current weather conditions and the expected developments, ensuring viewers are well-informed about the meteorological events that may affect their region. The studio's sleek design and the anchor's professional demeanor convey the seriousness and accuracy of the broadcast.","In a modern news studio, an anchor in a dark suit confidently presents the latest weather forecast. Behind him, the wall is adorned with multiple screens displaying a detailed weather map, highlighting various weather systems and fronts. As he gestures towards the map, the overlay of different colors and symbols on the map indicate the movement and intensity of these weather patterns. The anchor's authoritative demeanor suggests the importance of the information being relayed to the viewers, ensuring they are well-informed about the upcoming weather conditions.",0.9889,0.9386,0.7647,25.64,2
"In a dimly lit room, a person stands at a podium, addressing an unseen audience. The focus is on the individual, who seems to be delivering a speech or making an announcement, as indicated by the microphone and the formal setting suggested by the podium. The atmosphere is serious and the person appears to be engaged in a significant discourse, possibly at a formal event or conference.","In a dimly lit room, a man in a dark suit and tie stands at a podium, addressing an unseen audience. He is speaking into a microphone, his posture and hand gestures suggesting a formal and possibly important speech or announcement. The red graphic overlay on the screen indicates that this may be a significant moment, possibly captured for a broadcast or recording. The man's expression and demeanor convey a sense of solemnity and gravity, suggesting the topic of his speech is of considerable consequence.",0.9899,0.8315,0.5283,27.32,2
"In a cozy room filled with books, two individuals engage in a playful and animated game of rock-paper-scissors. The excitement builds as each participant puts their best effort into winning, showcasing a range of emotions from concentration to joy and disappointment. The game continues with a series of back-and-forth rounds, each one intensifying the competitive spirit between the players. The room's ambiance, illuminated by soft lighting, adds to the intimate and friendly atmosphere of the game, highlighting the camaraderie and lighthearted nature of their interaction.","In a cozy room filled with books, two friends engage in a playful game of rock-paper-scissors. Their hands clasp eagerly as they take turns making their moves. With each round, their excitement builds, and their gestures become more animated. The game intensifies, and they lean in closer, their focus unwavering. Suddenly, in a burst of energy, one of the friends triumphantly throws out a winning hand, and they both erupt into laughter, their joyous expressions reflecting the light of the fairy lights that adorn the room. The game has brought them closer, strengthening their bond of friendship in this warm and inviting space.",0.9884,0.8475,0.4763,25.48,2
"The video captures a thrilling motorcycle ride across a long bridge. The rider's perspective is shown as they speed along the of a causeway, with the expansive ocean on one side and the sky above. The sense of speed and freedom is palpable as the motorcycle cuts through the air, the rider's helmet visible in the frame. The bridge stretches for miles, a testament to human engineering, while the surrounding waters hint at the vastness of the landscape. The rider's focus is unwavering, their body leaning into the turns as they navigate the road. The experience is one of exhilaration and adventure, a journey across a threshold into the open road ahead.","The video captures a thrilling motorcycle ride across a long bridge. The rider's perspective is shown as they speed along the of the island, with the expansive ocean on one side and the sky above. The sense of freedom and the rush of the wind are palpable as the motorcycle passes by, hinting at the excitement and adrenaline of the journey. The open road and the endless horizon create a sense of adventure and exploration, inviting the viewer to join in this exhilarating experience.",0.9786,0.9024,0.7016,27.08,2
"In a dimly lit room, a person is attempting to ride a mechanical bull. The rider, dressed in a green shirt and blue jeans, is seen trying to maintain balance as the bull bucks and twists. Despite the challenge, the rider manages to stay on, albeit with a struggle, as evidenced by the hand they are using to stabilize themselves. The scene is illuminated by a red light, adding to the atmosphere of the venue, which appears to be a bar or entertainment establishment. The rider's focus and determination are evident as they navigate the unpredictable movements of the mechanical bull, providing an exciting spectacle for onlookers.","In a dimly lit room, a person is attempting to ride a mechanical bull. The rider, dressed in a green shirt and blue jeans, is seen trying to maintain balance as the bull bucks and twists. Despite the challenge, the rider manages to stay on, albeit with a somewhat unsteady posture. The bull's movements are erratic and forceful, causing the rider to grip tightly and use their body to counterbalance the motion. The rider's focus is intense as they try to stay on the bull, showcasing a test of skill and balance.",0.9936,0.9029,0.7102,26.3,2
"In the serene backdrop of a lush landscape, a person engages in a dynamic display of martial arts. The individual, dressed in casual attire, exhibits a series of precise and controlled movements. With each gesture, they demonstrate a range of techniques, froms to, showcasing their agility and skill. The fluidity of their motions suggests a deep familiarity with the, as they seamlessly transition from one form to the next. The natural setting provides a stark contrast to the disciplined and focused nature of martial arts, highlighting the harmony between human potential and the tranquility of nature.","In the serene backdrop of a lush green landscape, a person engages in a dynamic display of martial arts. The individual, dressed in casual attire, exhibits a series of precise and controlled movements. With each motion, they and pivot, their arms flowing through a sequence of techniques that showcase their skill and agility. The fluidity of their motions suggests a deep familiarity with the, indicating a practice that is both disciplined and graceful. The surrounding environment, with its verdant hills and tranquil waters, provides a stark contrast to the energetic display, highlighting the solitary and introspective nature of martial arts practice.",0.9646,0.9037,0.7556,27.12,2
"In the warmth of a cozy room, a child dressed in a delicate white dress adorned with a bow stands in front of a beautifully decorated Christmas tree. The tree is festooned with twinkling lights and ornaments that shimmer in hues of red and gold. The child's small hand reaches out with curiosity and wonder, eager to touch the ornaments that hang like colorful fruits from the branches of the tree. With each gentle touch, the ornaments sway, casting a playful glow on the child's face. The excitement and joy of the holiday season are palpable as the child explores the tree, each ornament a new discovery. The scene is one of pure, unadulterated delight, a snapshot of childhood magic and the timeless charm of Christmas traditions.","In the warmth of a festively lit room, a young child, dressed in a delicate white dress, experiences the joy and wonder of decorating a Christmas tree. With each gentle touch and careful placement, the tree comes to life with the sparkle of colorful lights and the soft rustle of ornaments. The child's small hands work meticulously, hanging ornament after ornament, each one a unique piece that adds to the tree's vibrant display. As the tree becomes more adorned, the room is filled with the spirit of the season, and the child's face lights up with the same joy that the tree now embodies. This moment captures the essence of holiday traditions, a time for giving, sharing, and celebrating the magic of Christmas.",0.9708,0.8994,0.5719,27.13,2
"In a workshop setting, two individuals engage in a traditional craft, possibly a form of woodworking or metalworking. One person, wearing a white t-shirt, is intently focused on their task, using a tool to carefully shape or carve a long, slender piece of material. The other individual, dressed in black, appears to be either instructing or assisting in the process, holding the workpiece steady while the carving takes place. The repetitive nature of the task suggests a high level of skill and precision is required for the work being done. The scene captures the essence of craftsmanship, highlighting the importance of concentration, technique, and the passing on of traditional skills.","In a workshop setting, two individuals engage in a playful yet focused activity, seemingly practicing or demonstrating a skill. One person, wearing a white t-shirt with a graphic design, holds a long, slender object, possibly a musical instrument or a tool, and appears to be instructing oring the other person. The second individual, dressed in a black outfit, attentively observes and possibly follows the actions of the first. The scene suggests a learning or mentoring moment, where the first person guides the second through a hands-on experience, sharing knowledge or technique in a hands-on manner. The environment, cluttered with tools and equipment, indicates a space dedicated to craft or artistry.",0.9915,0.8137,0.5394,27,2
"The video captures a lively and dynamic atmosphere, possibly at a social gathering or event. The scene opens with a blurred and indistinct view, which quickly focuses to reveal a group of people engaged in a game or activity involving throwing balls or similar objects. The participants are seen aiming and throwing these objects, possibly targeting a specific area or playing a competitive game. The mood is energetic and bustling, with the participants fully immersed in the activity. The camera captures the movement and excitement of the game, possibly panning or following the trajectory of the thrown objects. The lighting is dim, suggesting an indoor setting, and the ambient sounds indicate a social environment with possibly cheering or chatter. The video provides a snapshot of a moment of camaraderie and fun, highlighting the human connection and shared experiences that bring people together.","The video captures a tense and suspenseful scene, likely from a thriller or horror genre. The camera moves stealthily, following a character or the action as it unfolds. The setting is dimly lit, creating an atmosphere of mystery and unease. The use of a red square on the screen adds to the sense of foreboding, possibly indicating a danger or warning. As the scene progresses, the environment becomes increasingly dark, heightening the suspense. The final frame is almost completely black, suggesting a sudden and ominous event, such as a power failure or an impending threat. The overall mood of the video is one of anticipation and fear, leaving the viewer on the edge of their seat, eager to know what will happen next.",0.982,0.5691,0.4105,27.04,2
"The video captures a man's journey as he explores a natural environment. It begins with a close-up shot of his hand, which then leads into him walking through a forest. The man appears to be on an adventure, perhaps hiking or exploring, as he navigates through the woods. The camera follows him closely, capturing his movements and the surrounding nature. At one point, he pauses to examine something in his hand, showcasing his curiosity and attention to detail. The video continues to follow the man's progress as he moves through the forest, immersing viewers in the serene and peaceful atmosphere of the woods.","The video captures a man's journey as he explores a natural. He is seen walking through the lush greenery, perhaps admiring the beauty of the surroundings. As he continues on his path, he seems to be searching for something, his expression one of determination. Eventually, he reaches a stunning waterfall where he is seen standing at the edge, gazing up at the cascading water. The serene environment and the man's contemplative demeanor suggest a moment of reflection or discovery. The video evokes a sense of adventure and the pursuit of finding tranquility in nature.",0.9812,0.8323,0.5287,27,2
"In the video, a group of people is gathered in a lively outdoor setting, possibly at a festival or concert. The crowd is engaged in various activities, with some standing and others sitting on chairs. The atmosphere is casual and festive, with individuals dressed in a relaxed manner, some without shirts. The scene captures the energy and camaraderie of the group as they enjoy the event together.","In the video, a group of people is gathered in a lively outdoor setting, possibly at a festival or concert. The crowd is engaged in various activities, with some standing and others sitting on the grass. The atmosphere is casual and festive, with individuals dressed in a relaxed manner, some without shirts. The scene captures the energy and communal spirit of the event, as people enjoy the music and the company of others.",0.9887,0.9565,0.897,26.76,2
"In the serene setting of a calm lake, a person is captured in the midst of an exhilarating wakeboarding adventure. The individual, clad in a sleek wetsuit, skillfully maneuvers a wakeboard, cutting through the tranquil water with precision and grace. As they glide across the surface, the wakeboarder's movements create a dramatic spray of water that trails behind them, adding a dynamic element to the scene. The backdrop of the surrounding landscape, with its lush trees and distant mountains, enhances the sense of freedom and adventure that is palpable throughout the video. The wakeboarder's fluid motions and the natural beauty of the location combine to create a captivating visual narrative that speaks to the thrill and joy of water sports.","In the serene setting of a calm lake, a daring individual takes to the water on a pair of skis. With confidence and skill, they glide across the surface, leaving a trail of white foam in their wake. As they navigate the tranquil waters, the skier's silhouette is captured against the backdrop of a majestic mountain range, adding a sense of grandeur to the scene. The skier's movements are fluid and graceful, demonstrating a harmonious blend of speed and control. The surrounding landscape is lush and verdant, reflecting beautifully on the placid water. This exhilarating display of water skiing showcases not only the athlete's prowess but also the breathtaking beauty of nature.",0.9873,0.7444,0.5624,26.52,2
"In the video, a person is seen preparing for an event or competition. They are wearing a white jacket with a blue logo on the left chest area. The person is holding a pair of green gloves in their hands and appears to be getting ready to put them on. They are standing in what seems to be a dressing room or backstage area, with other people and equipment visible in the background. The person's movements suggest they are focused and perhaps a bit nervous, as they carefully handle the gloves and adjust their jacket. The overall atmosphere of the video is one of anticipation and excitement for the upcoming event.","In the video, a person is seen performing a jump rope routine. They are wearing a white jacket and are jumping energetically. The background music adds to the lively atmosphere of the performance.",0.989,0.5988,0.5248,24.71,2
"In a dimly lit room, a person in a white coat performs a dramatic fire demonstration. The experiment seems to involve a large glass container where a fire is ignited. As the fire burns, the individual carefully observes and manipulates the flames, perhaps controlling the oxygen supply to fuel or subdue the fire. The audience, visible in the background, watches with anticipation as the fire dances and flickers within the confines of the glass, showcasing the fascinating interplay between fire, chemistry, and physics. The controlled environment suggests an educational or experimental setting where the principles of combustion or fire safety are being demonstrated or studied.","In a dimly lit room, a person in a white lab coat conducts an experiment involving the ignition of a substance. The process is observed by an audience seated in a dark auditorium. The experimenter carefully places a lit firework into a glass container, causing a violent reaction as the contents ignite, producing a fiery display within the confines of the container. The intense heat and flames generated by the combustible reaction are clearly visible as the experiment unfolds. The audience watches with anticipation and curiosity as the controlled explosion takes place, demonstrating a scientific principle or the testing of a new material. The scene captures the excitement and the educational aspect of live scientific demonstrations.",0.9895,0.8305,0.548,27.63,2
"The video showcases the creation of a cartoonish dragon character through the stages of a hand-drawn animation. It begins with the rough outlines of the dragon's head and progresses to the refinement of features and details. The artist's hand meticulously adds definition to the dragon's eyes, mouth, and wings, bringing the character to life on the paper. Throughout the clip, the dragon's expression transforms from a blank canvas to a playful and expressive countenance, complete with a mischievous smile and a hint of a tongue sticking out. The final touches highlight the dragon's whiskers and the texture of its scales, adding a sense of depth and personality to the character. The video captures the entire creative process, from the initial sketch to the finished portrait, demonstrating the artist's skill and attention to detail in character design.","The video showcases the creative process of an artist bringing a character to life through drawing. It begins with a rough outline of the character's head, which gradually evolves as the artist adds more details and refines the features. The process involves careful shaping and re-shaping of the character's facial structure, indicating the artist's meticulous attention to capturing the desired aesthetic. Throughout the clip, the artist's hand moves with precision, making adjustments and adding finishing touches to perfect the character's appearance. The final image reveals a complete and well-defined character, suggesting the artist's skill in creating detailed and expressive drawings.",0.991,0.7057,0.5855,24.46,2
